,Unnamed: 0.1,Unnamed: 0,comment
3106,3106,3106,habib cerita mmh nya vidi aku ikutan mewek
3107,3107,3107,seru nih seru seru 
3108,3108,3108,ngakak banget nonton ini hahahaha
3109,3109,3109,ya allahsabar2 banget ya kakak2 nya vior bertiga iniih masha allahtapi tetepjuara pria tersabar ada di vincent  congrats for your wedding vior vincent
3110,3110,3110,part 2 podhub ci vior  n ko vincent 
3111,3111,3111,undang pakmuh sama fadil pasti pecah
3112,3112,3112,ok
3113,3113,3113,plot twist bgt endingnya ternyata tetanggan vior vidi 
3114,3114,3114,hadiirrr
3115,3115,3115,kalo soal macam2 gaya kebetulan saya ini sangat berpengalaman ok saya langsung jawab aja yah jadi 5 mnt pertama itu dik vior bisa pake gaya punggung 5 mnt kedua boleh pake gaya kupu2 5 mnt ketiga ganti gaya katak 5 mnt berikutnya coba gaya paus orca dijamin maknyus sampai masuk ugd
3116,3116,3116,vior polos lucu  pikirannya positif
3117,3117,3117,video baru
3118,3118,3118,saya nonton dari awal sampai akhir ngakak terussehat selalu habib om ded ka vior  sama ka vidi
3119,3119,3119,saking penasarannya sampe aku tonton ulang video clip nya senyumin dulu aja
3120,3120,3120,lagi cape2 nya hidup tiap lihat vior hati jadi bahagia ketawa mulu sampe perut sakit
3121,3121,3121,viorrr anjirr
3122,3122,3122,kakk habib plizzz wkwk
3123,3123,3123,kapan yang bintang tamunya mae soimah tayangsaya kirain sabtu initernyata bukan
3124,3124,3124,super ngakak klo ada vior
3125,3125,3125,kapan yang bintang tamunya mae soimah tayangsaya kirain sabtu initernyata bukan
3126,3126,3126,ya allah masker gw ampe coplok ngwtawain reaksi habib om ded sm vidi nanggepin viro
3127,3127,3127,habib toleransi sebenarnya islam itu indahsaya orang hindu respect habib
3128,3128,3128,habib auto stress ngadepin vior
3129,3129,3129,setiap ketemu deddyy kkena fitnahan mulu 
3130,3130,3130,ngehibur bangetlucunya natural gitu habibom dedyvidi dan vior saling melengkapisemoga selalu sehat dan terus berkarya
3131,3131,3131,pokoknya kalo vior digabungin sama habib udah paling pecah lucu banget
3132,3132,3132,kayaknya login tahun depan kocak sih kalo partner nya habib tuh vior dia terlihat lebih excited dan pertanyaan yg keluar dari dia tuh mind blowing bgt tp related sama pikiran kita yg ada dipikiran tp nyampeinnya bingung soalnya kadang celetukan dia aneh tapi emang perlu di pertanyain 
3133,3133,3133,menurut gw sih ini acara paling berkah dari semua channel yg gw subscribe bikin ngakaksakit jadi cepat sembuhdopamine naikbest bgt sihwalau gak ada tema tapi banyak yg bisa diambil buat pelajaranthanks om botak vidi lawak crew hebat serta bintang tamu nyajgn pernah berhenti berkarya ya kaliansehataamiin ya robbal alamiin
3134,3134,3134,yaa allah yaa robbi pekerjaanmu sungguh berat bib
3135,3135,3135,andai ad acara ramadhan habib sm vior slalu bereng
3136,3136,3136,habib sama vior selalu seru
3137,3137,3137,ini cast apa ini 
3138,3138,3138,ngakak ekspresi ny om ded pas vior ngomong tuh kek mlongo gitu 
3139,3139,3139,capeeekkk bgt woyyy hahahahaha
3140,3140,3140,habib jafar gue yang bohong  3623
3141,3141,3141,pokoknya klau ad vior q pasti nonton soal nya dia kocak njir
3142,3142,3142,woooooiiiiiiiiii mana tayangan syuting podhub maeeee soimah jirrr mana mana mana
3143,3143,3143,sepanjang video ngakak guee
3144,3144,3144,jancuuuukkkkk the best sihh  episode yg paling amat bagus selama nonton podhub 
3145,3145,3145,1300 paraaahh 
3146,3146,3146,ini viorrr plusnya cantik jadi ekspresinya bisa lucucba kalo engga jijik iya
3147,3147,3147,ya allah ya robi vior
3148,3148,3148,plis kak yang kirimin itu gamis kayak gitu pengen bangett bole dipake untuk hari jumatan
3149,3149,3149,habib mualaf dua kata lucu
3150,3150,3150,bener kata vincent moodbooster banget nonton cici gemoy satu ini
3151,3151,3151,jadi gak sabar login eps vincent sama vior aakkkkkk
3152,3152,3152,ngakak banget setiap nonton podhub apalagi ada vior sama habib
3153,3153,3153,lucuuuu
3154,3154,3154,astaghfirullahdari awal ampe akhirgue ngakak trs anjirrr habibvior ditunggu part 2 nya ya om ded
3155,3155,3155,sepanjang podcast ini ngakak banget tanpa jeda gigi kering pkonya
3156,3156,3156,pantesan di simpen pecah bgt episode ini
3157,3157,3157,sepanjang pothab ngeliatin ekspresinya omded 
3158,3158,3158,suka banget episode ini please om satuin vior halda dan jirayut
3159,3159,3159,cvior geloooo aku ngakak trs ini
3160,3160,3160,vior udah semakin pinter semenjak bergaul ama org2 pinter
3161,3161,3161,baru ini nonton pot hub ada emosionalnya gara vior wkwkwk
3162,3162,3162,5912 pertanyaan agak wdaw ini 
3163,3163,3163,memang hari sabtu memang nunggu nya pod hubhari sabtu hari pod hub
3164,3164,3164,part 2 di login aja wkkwkkw
3165,3165,3165,ngakak bgt liat ekpresi om ded di sepanjang vidio
3166,3166,3166,hahaha
3167,3167,3167,pecaaahhhhh abieeeeezzzz 
3168,3168,3168,coki  pemuda tersesatvior  aku tersesathabib tretan  cuakkkzzz
3169,3169,3169,gue liat vior sama habib  liat komenan bikin ngakak 
3170,3170,3170,rame bgt podcast kali ni 
3171,3171,3171,di menit 59 gua ngakak bnget seru semua shok
3172,3172,3172,vior bener bener cewek yang paling lurus dan polos nya gk ketulungan 
3173,3173,3173,rame bet ada bg pior 
3174,3174,3174,habib ft vior selalu pecaaahhh 
3175,3175,3175,suka bgt sama vior lucuwkwk dmn ad vior aq nontoninbahagia selalu yah
3176,3176,3176,vior anj
3177,3177,3177,kocak gaes
3178,3178,3178,wkakakakaka gokil nihh
3179,3179,3179,vior sumpah saya cinta suka sayank sama kamu yakin gua  pincen lelaki yg tepat buat kamu  vior the best 
3180,3180,3180,habib vs viorudah pasti rameee
3181,3181,3181,ngakak terus viorviorr
3182,3182,3182,seru banget
3183,3183,3183,beruntung banget hidup om dedi sama vidi aldiano udh kaya raya bisa berteman sama orang dalam surga yaitu habibudah bahagia di dunia diakhirat pula
3184,3184,3184,vidi aries ya emang ga pinter boong ang ang angggg
3185,3185,3185,podcast terkocak dan terlucu selain dengan teh ocha ya epidose ini ngakak abis deh 
3186,3186,3186,gue nyengir melulu dari awal pe akhir pe gigi kering
3187,3187,3187,seruu 
3188,3188,3188,padahal seru an habib jafar kayaknya drpd anya
3189,3189,3189,di tunggu soimah sama dc buat ngajari kak vidi untuk konsisten jadi penyanyi
3190,3190,3190,deddyvidihabib keliatan lelah banget yaa ngadepin vior kwkwkwkwkw
3191,3191,3191,ka bisaa ga sihh podhub janga tayang seminggu sekali 
3192,3192,3192,kak vidialdiano tangannya kaya ada bekas infusan semoga lekas membaik dan terus bahagia dimanapun kaki berpijak 
3193,3193,3193,ntabs
3194,3194,3194,kenapa logo podhub nya harus mirip p0rhub ya bang
3195,3195,3195,habib sama vior kocak wkwk
3196,3196,3196,kali ini aku nya asli ngakak om ded sering dah u dang bintang tamu ky vior biar tambah menghibur tp aku mendukung bnget kl habib sll ikutan jg
3197,3197,3197,episode terpanjang dan terseru ketawa terus
3198,3198,3198,seru bangetttt sumpaa lucuu baru pertama lali ini tauk komen di yt karena ini lucu bangetttttt
3199,3199,3199,satu2nya habib yg saya sukasemoga banyak yg mengikuti jejak beliau yg bikin umat agama toleransi dan sejuk
3200,3200,3200,gila sih ini podhub ter kereeeennnn terseruuuuuuu thanks for habib jafar dan vior
3201,3201,3201,4220emang aku ga bisa dimainin ya im done 
3202,3202,3202,cuma habib ini yg gak cerita khurofat ngibul
3203,3203,3203,selamat ulang tahun vidi
3204,3204,3204,udang vior lagi dong
3205,3205,3205, parah ini
3206,3206,3206,nonton sampai 2x 
3207,3207,3207,makasih podhup udah menghibur bangettt dari awal sampe akhir bikin ngakakkk
3208,3208,3208,capeek ketawaa gw nontonnyaa 
3209,3209,3209,vior kocak bener
3210,3210,3210,tapi bercanda dajal2 itu serem sih naudzubillah
3211,3211,3211,mood bgt ketawa terus
3212,3212,3212,kak habib pacaran sama katolik
3213,3213,3213,polos tapi enggak gimana si
3214,3214,3214,om dad aku juga member osbond
3215,3215,3215,kalau habib ketemu vior mantap
3216,3216,3216,gw nonton 2 kali dari awal tanpa skip 
3217,3217,3217,cocok buat malming nih
3218,3218,3218,ya allah ini baru 17 menit berasa udh sejam ga keitung gua ketawa berapa kali thankyou omded udh ngudang si vior lagi jangan lupa masyaallahnya diucap terus ya
3219,3219,3219,430 combo maut 
3220,3220,3220,vior ya allah booster banget
3221,3221,3221,nonton berulang kali juga tetap ngakak 
3222,3222,3222,aku baru kelar nonton trs ku nonton ulang lagi
3223,3223,3223,3624 sabar bib
3224,3224,3224,gpp bikin lgi vdio ya yg bersma habib
3225,3225,3225,kirain mae soimah tayang
3226,3226,3226,asli kalo ada vior rame pwolllll
3227,3227,3227,mntb
3228,3228,3228, mantep banget naadanya 955
3229,3229,3229,udah bikin dua versi video clipnya keren pasti yuk bs yuk 
3230,3230,3230,dimana ada vior dan habib pasti seru
3231,3231,3231,sebenernya udh bbrpa momen vior mau bacain tulisan di telapak tangan dia tpi habib sma vidi motong mulu
3232,3232,3232,sekosong itu 
3233,3233,3233,vior good vibe banget 
3234,3234,3234,gas full
3235,3235,3235,klo ada habib dan vior tu emg mood booster ya ngakak terus ngeliat kepolosan vior 
3236,3236,3236,10840 sebutan baru  vidi dajjal 
3237,3237,3237,ya allah vior tololnya alami ya lucu banget
3238,3238,3238,sukaaaaaaa makasih podhub
3239,3239,3239,baru kali ini om ded di pegang cw gak blushing malah kesel
3240,3240,3240,1050 om jangan om 
3241,3241,3241,4 orang ini master of kocakdeh
3242,3242,3242,setelah mumet dengan drama dokter dokter belakangan ini terbitlah konten untuk merefresh otakterima kasihom dedkak vidikak habib kak vior telah menghiburhehe
3243,3243,3243,4008 ngakakkk bgtt om ded sampe istighfar
3244,3244,3244,khawatir aku di video ini karena gk ada yg basicnya komedian biar bisa menyapu dan buat hal tabu jadi komedi
3245,3245,3245,wah kak habibb
3246,3246,3246, episode paling menghibur dari awal sampai akhir
3247,3247,3247,
3248,3248,3248,sumpah klo liat vior dimana mana pasti bikin ngocok perut 
3249,3249,3249,vior nganggap habib kyk chat gpt
3250,3250,3250,hahahahhahahaha
3251,3251,3251,ngakak bangettt
3252,3252,3252,habib keluar kalimat ultimate 
3253,3253,3253,kak habib 
3254,3254,3254,vior bner2
3255,3255,3255,viorblucu bgt siiy perfect combo dah sama kak habib
3256,3256,3256,vior  habib is the best 
3257,3257,3257,tolong undang lagi vior bareng vincent di podhub selanjutnya tpi bareng habib jafar jga asli seru bgt tau klau mereka berempat disatuin selain kocak ada jga ilmu yg didapat didalemnya makasih udh undang vior lgi moodboster bgt asli
3258,3258,3258,vior serius lo nanyak gitu sama habib
3259,3259,3259,om login  onad ganti vior aja om 
3260,3260,3260,nih kalo tambah onad makin kocak nih 
3261,3261,3261,seru bnget pliss ga berhenti ketawa
3262,3262,3262,lucuu bgtttttt
3263,3263,3263,ekspresi vidi sm om dedy bikin ngakak stiap vior ngomong
3264,3264,3264,vior sm dr boyke kayanya asik jg
3265,3265,3265,vidi  strada teh saha nangis bgt
3266,3266,3266,the bestt habib  vior
3267,3267,3267,ditunggu part 2 
3268,3268,3268,855  ka vidi  sering tau om ded bilang masyallah
3269,3269,3269,podhub dari deddy corbuzier kayak terinspirasi dari situs pornhub iya gak
3270,3270,3270,dia tidak menghentikan hujan tapi membuat kita tidak kedinginan dan basah karna kehujanan habib jafar
3271,3271,3271,kok bisa to vior
3272,3272,3272,busett dah si etot slalu bikin tertawa
3273,3273,3273,kocak
3274,3274,3274,dari podcast ini emang keliatan vior tu tulus ya sebenarnya gue gak suka2 amat dia di podcast bbk mungkin tergantung orang yg ngomong sama dia kali ya kalo di sini seru si vior dan positive vibes bgt pembawaannya
3275,3275,3275,trimakasih ya kalian ber4 bikin ak happy samawa ci vior sm ko cent
3276,3276,3276,vidi make up tebel amet biar tetep keliatan fresh
3277,3277,3277,sabar bib 
3278,3278,3278,bikin video clips habib version
3279,3279,3279,beneran dech ngakak mulu dari awal sampai akhirsmile line ku nmbah kayak nya
3280,3280,3280,nyengir lu 4933
3281,3281,3281,mood banget kalau udh habib di satuin sama vior sejam gua tontoni
3282,3282,3282,vior mulutnya kalo ngmg gak bisa dijaga menjijikkanmemalukan
3283,3283,3283,buahahaha ada vior
3284,3284,3284,capek banget ketawa
3285,3285,3285,2026 
3286,3286,3286,ngakak
3287,3287,3287,kiraiin hidup aja yg bikin capek tapii dengeriin vior aja cape ya allah
3288,3288,3288,                      
3289,3289,3289,sepertinya sudah mulai mengulang bintang tamu ya hahahaha ayo coba yg lain lagi om hehe
3290,3290,3290,pleaseeee part 2 dongg habib vincent vior di podhub
3291,3291,3291,wkwkwk vior2 ya ampun kok bkin perutqu mulesom ded undang vior ma habib jafar trussssss yaa
3292,3292,3292,vior ama vidi kombinasi podcaster dan bintang tamu yang cocok anjiir wkwkw
3293,3293,3293,fior lucu banget
3294,3294,3294,sepanjang podcast ini ga berenti ngakak  istighfar 
3295,3295,3295,855 om dedi be like  
3296,3296,3296,ada vior selamat menempuh hidup baru vior
3297,3297,3297,
3298,3298,3298,seru kalau ada 2 orang ini
3299,3299,3299,iya nonton podhub only karna vidi bukan karna om ded atau binatang tamu
3300,3300,3300,nanyain gaya ke habib  dbilang bocah kosong tpi mw merit ya allah viooorrr
3301,3301,3301,nanti pulang dia dari australi undang dia lagi
3302,3302,3302,capek bgttttt 
3303,3303,3303,part 2 nyaaaaaa
3304,3304,3304,banyak2 istighfar tp ngakak banget sih sm kak vior 
3305,3305,3305,combo terbaik wkwk
3306,3306,3306,wkwkkwkwkw ngakak
3307,3307,3307,ya allah viorrr gw capek nontonnya tapi ngakak jugaa 
3308,3308,3308,sabar kak habib
3309,3309,3309,sptnya vidi ama vior 11   12 polos banget dgn versi yg berbeda kocaaaak abis sehat slalu kalian team podhub
3310,3310,3310,hahaha
3311,3311,3311,vior sangat polos  nanya ke habib
3312,3312,3312,ini  podcas terkocak hahahaa 
3313,3313,3313,bengek gw nontonnyaketawa mulu
3314,3314,3314,another question viorbibklo sudah suami istri nonton boke bareng boleh gak
3315,3315,3315,kita hidup bukan apa kata orang tapi apa kata tuhanhabib jafar2832
3316,3316,3316,combo epic habib jafar vidi vior om ded 
3317,3317,3317,anjiirtttt gue ketwa trus
3318,3318,3318,siapa disini dr awal nntn smpe akhir cape cape ketawa
3319,3319,3319,capee bgt ketawa dr awal sampe akhir ampe ngakak ngakak mood boster bgt lagi sakit n mood drop nambah pahala kalian menyenangkan banyaaak orang ya jazakamullah
3320,3320,3320,akhirrrnyaaaa habib sma vior
3321,3321,3321,cowok non muhrim g4y wkwkwkw
3322,3322,3322,ayo bib ngaku aja lah kalo pernah pacaran sama orang katolik
3323,3323,3323,di waktu sehat dan sehit
3324,3324,3324,habib mualapwkwkwk
3325,3325,3325,pleasee podhub undang vincent habib dan vior di satu episode
3326,3326,3326,akhirnya
3327,3327,3327,untung ada khabib
3328,3328,3328,the question of vior bib sebagai seorang istrigaya apa yang memuaskan suami anjirrr lah
3329,3329,3329, untung vidi orgnya asik jadi pass di pojokin dia paham ini cmn jokes please jgn pojokin org2 sakit kyk kavid  slalu dukung kavid
3330,3330,3330,vidi  nangis bkn karna mmahnya minta doa habib tpi krna d panggil dhazal
3331,3331,3331,seruu
3332,3332,3332,vior dengan punchlinenya lagunya siapa tu 
3333,3333,3333,seneng banget colab vior sama habib jafar
3334,3334,3334,nihh yang nyari vior nanya gaya apa yang bisa memuaskan di menit 5914  jangan lupa like
3335,3335,3335,sepanjang ntn podcast tuh lucu parahsukses sllu buat semuanya
3336,3336,3336,sakit banget ne pipi ketawa mulu
3337,3337,3337,2kata lucu lainnya cowok nonmuhrim gay 
3338,3338,3338,buset dah si etot
3339,3339,3339,habib jafar
3340,3340,3340,buset dah si etot
3341,3341,3341,buset dah si etot
3342,3342,3342,hhhhhhhhh hhhhhhhhh
3343,3343,3343,no komen kalau ini orang bertiga ketemu aduhh pembahasan ngakaknya ga abis abis dahhh
3344,3344,3344,acara login tahun depan jangan lupa
3345,3345,3345,1341 langsung kena pencahayaan vior 
3346,3346,3346,gua kasian ama om ded benerbener berusaha  nyapu katakata vior biar habib kaga emosi tapi malam om ded sendiri yang emosi wkwk
3347,3347,3347,sakit perut ngakakk
3348,3348,3348,ketawa sampe lemes
3349,3349,3349,ka habib kesel wkwk
3350,3350,3350,menit 5914 
3351,3351,3351,podhub episode paling menghibur si ini
3352,3352,3352,podhub hari ini luat biasa
3353,3353,3353,andai vior ini salah ngomong pasti tetap banyak yg bela 
3354,3354,3354,pecah lagi aja 
3355,3355,3355,4930 my fav lol
3356,3356,3356,undang anya sama habib biar klarifikasi lagu vidi
3357,3357,3357,nungguin jawaban dari habib  untuk pertanyaan vior menit 5915pasti banyak jg yg nungguin hhhhh
3358,3358,3358,ngakak 
3359,3359,3359,4118 ada suara bocor nih wkwkwk
3360,3360,3360,eca ga dateng ke nikahan vior ya
3361,3361,3361,mama besba minta doa ke habib buat kesembuhan vidi sih itu paling the best sehat selalu mama besba
3362,3362,3362,kocak sekali 
3363,3363,3363,gw pusing
3364,3364,3364,kak habib sangat sopan skali vior 
3365,3365,3365,wakakak fakta bisa jadi fud up klo vior yg menyampaikan 
3366,3366,3366,habib tuh definisi orang tua isinya ceramah mulu
3367,3367,3367,perfect combo habib n vior
3368,3368,3368,reng bendebesah ngompol dinnak
3369,3369,3369,vincent jadi bodoh setelah nikah sama vior
3370,3370,3370,viooor
3371,3371,3371,aku jual es teh 
3372,3372,3372,nyesel aku nonton ini sambil makan keselek terus karena ketawa ketawa
3373,3373,3373,duo maut vior dan habib pasti ketawa non stop 
3374,3374,3374, ngakak asli ada vior tapi bner2 good
3375,3375,3375,tapi gw suka lo perpaduan vior dan kak habib
3376,3376,3376,vior dengan kepolosan dan kesalahpahamannya lucu bnget 
3377,3377,3377,ngakak banget kalo udah ada vior sama habib
3378,3378,3378,mood bgt vior 
3379,3379,3379,om ded menghela nafas sepanjang video 
3380,3380,3380,
3381,3381,3381,another quotes vior kalo dikamar boleh berisik gak sayang 
3382,3382,3382,ini baru tayang yah pas mau acara nikahnya vior kan cuma baru di tayangin
3383,3383,3383,dicky difi sama uus om
3384,3384,3384,om ded podhub selanjutnya dongprilly dan aliando
3385,3385,3385,suka banget sama vior emang bener moodbooster bgt anaknyaa keliatan tulus jugaaa
3386,3386,3386,undang akang mv deh soalnya bnyak cerita hidupnya bsa d ceritaain plisss om ded
3387,3387,3387,gua udh demen dah klo podcast udh ada habib jafar vior  ada aja omongan nya
3388,3388,3388,kocak coi bawaanya ngakak aja 
3389,3389,3389,seru bangetbikin ketawa trusdari yg cuma senyumketawa gk ada suara sampe ke level ketawa yg ngakak keras bgtvibesnya keren ini orang2
3390,3390,3390,waduh waduhkenapa habib dateng ke pudhubgini kan jadinya
3391,3391,3391,undang aisar please
3392,3392,3392,bagus nih undang vincent vior after meriied ke podhub
3393,3393,3393,capek bgt dari awal smpe akhir ketawa trs
3394,3394,3394,ga expect ama the last question nya vior
3395,3395,3395,quotes vior  emang aku gak bisa dimainin yha 
3396,3396,3396,5957  kl jamaahnya habib ada kyk vior 3org habib pilang g jd dawah
3397,3397,3397,sumpah ini seru bgt dari awal sampe selesai gua ngakak terus
3398,3398,3398,ngakak banget pliss eps ini
3399,3399,3399,kita samasama doain vior dan vincent langgeng terus sampe maut memisahkan ya gess
3400,3400,3400,
3401,3401,3401,ya allah vior cape wkwkwkw
3402,3402,3402,viorya ampunpolos banget ne anakselamat atas pernikahan viorbahagia selalu sampai kakeknenekberkah melimpah ruah amin
3403,3403,3403,wkwk udah ketiga kali orang ini di sini dan sekalu seru
3404,3404,3404,edisi paling njancuki
3405,3405,3405,
3406,3406,3406,ngakak dr awal sampe akhir
3407,3407,3407,kali ini gua seneng bgt bintang tamu nya
3408,3408,3408,3320 tapi si dajj 
3409,3409,3409,bikin program buat habib sm vior berduaaa dongggg
3410,3410,3410,ngakak
3411,3411,3411,sepanjang nonton jadi ngakak poll 
3412,3412,3412,ketika tamu nya habib sama vior udah petcaaahhhhh deh  dr awal udah ketawa terus
3413,3413,3413,viorrr
3414,3414,3414,pusing ga si punya tmn ditongkrongan model kaya vior
3415,3415,3415,wkwkwkwk habib ga boleh marah tp kalo sama vior atau onad gpp bib kita bukan nabi boyyy
3416,3416,3416,ya ampun kocak banget habib disatukan sm vior baru kali ini nonton vior kukira nih bocah2 kosong yg alay ternyata emang sepolos itu dia penasaran apakah habib jd isi dakwah di nikahan vior konsep yg diluar nalar ini sih hahahaahha pernikahan katolik yg isi dakwah habib
3417,3417,3417,combo banget klo ad ustadz jafar sama viorsama2 berjiwa bersih dan kasihindahnya saling menghargai sebagai sesama mahluk ciptaannyaga sabar nunggu login
3418,3418,3418,ngakak guling2
3419,3419,3419,yaallah bru bntr nnton ngakakkk
3420,3420,3420,habib pasrah sekali sama pertanyaan vior
3421,3421,3421,tambah onat makin seru kali ya 
3422,3422,3422,ini haris ada part 2 sihh setelah mereka nika nihhh harus ada habib
3423,3423,3423,habib ngomong nya baik2 dong sama ka vidi
3424,3424,3424,hahaha mood boster bangetttttt
3425,3425,3425,daging kolestrol semua
3426,3426,3426,vior lucu banget 
3427,3427,3427,demi apapun sheila lu beruntung bgt pnya suami kayak vidi dan vidi emg sheila lah istri trbaik vidi
3428,3428,3428,selain desta ternyata vior juga bisa ya bikin habib gak bisa nahan sabar
3429,3429,3429,tiga kata neraka
3430,3430,3430,episode terlucu pod hub 
3431,3431,3431,gilak ini pecah bgt dr awal smp akhir ngakak trs
3432,3432,3432,3623  sampe kaget kenceng banget
3433,3433,3433,aku suka lihat muka deddy tak puas hati 
3434,3434,3434,348 kita bukan nabi tapi orang selama ini kenapa kok hadis untuk nabi yang di pakai sunah rosul sedangkan di ayat lain berbunyi emosi labil miskin apalagi gangguan metal haram hukumnya berumah tangga gimana tuh ini kan menyangkut anak dan problem hidup ke depan
3435,3435,3435,masyarakat indonesia itu lg butuh hiburan kenapa podhub cuma seminggu sekali  tambahin dong
3436,3436,3436,tebakan ku soimah di up pas tahun baru si
3437,3437,3437,tiap minggu nungguin podhub baru kali ini ngomenin episode ini bener ngakak terus seru banget 
3438,3438,3438,tau tauan mangga besar banyak pijit  wkwk gue orang mabes ini wkwo
3439,3439,3439,tinggal nunggu vidi dateng ke warung madura habib
3440,3440,3440,bilang habib sudah sopan tapi kak habib lebih sopan hehehe menyala vior
3441,3441,3441,semua video youtube yg ada cici pasti gw nntonin
3442,3442,3442,maksud vior lagu rumah ke rumah ciptaan baskara
3443,3443,3443,
3444,3444,3444,kadang seru kadang juga bingung sama vior kek di buat buat banget biar di anggap polos kadang juga greget lucu dengan polosnya  untung seneng lihat habib di uji kesabarannya sama vior
3445,3445,3445,guys tau ngga kalau kata meta vidi aldiano pelawak 
3446,3446,3446,vior mind blowing 
3447,3447,3447,akhirnya yg ditunggu tunggu habib ke podhub lagi 
3448,3448,3448,
3449,3449,3449,viorrrr bener bener lu yeee bikin ngakak smpe nangis sepanjang podcast 
3450,3450,3450,lucu bgtt 
3451,3451,3451,3529 ekspresinya habib kocak banget
3452,3452,3452,wkwkwkw plisss ini episode salad satu yang gueee sukaa wkwkwkw mood bngtt
3453,3453,3453,itu robot samping om ded ngingetin aku sama 
3454,3454,3454,keren habib 
3455,3455,3455,3558 semua kena stun di ulty vior mage
3456,3456,3456,habib disatuin sama vior sumpah kocak banget
3457,3457,3457,
3458,3458,3458,suka tp gk berlebihanhabib jaffar
3459,3459,3459,vior tuh emang polos atau gimana soal nya aku meragukan dia gara gara vidio 15 menit 
3460,3460,3460,vior itu santun lho memanggil rekan di podcast yg senior kk santun
3461,3461,3461,paket kumplit nih sumpah perpaduan bintang tamu yg cocokmereka semua kocak
3462,3462,3462,nguakak poll dri awal astafa
3463,3463,3463,kayak dunia pekerjaan dong bib suka fitnah nya kejam
3464,3464,3464,wah ada kak habib
3465,3465,3465,g mau di panggil bropinginnya habibhabib ini dh teralu merakar di indonesia bahsa keturunan nabi dari yananpadahal belum tentu lgi di uji kekarang2 iniyng pasti julukan panggilan keturunan nabi itu yng masyur adalah sayid dan sarif
3466,3466,3466,mending bikin vidio klip lagi yang ada habib nya dan om ded nyanyi 
3467,3467,3467,kelar piket posko nataru lgs nonton ini ngakakkkkkkk ilang lelah penat gue thanku podhub
3468,3468,3468,setiap lihat vior selalu dikepalaku keluar doa semoga yang mempunyai kondisi seperti vior selalu dalam lindungannya 
3469,3469,3469,ini nih yang ditunggu kolaborasi epic
3470,3470,3470,yaaa
3471,3471,3471,paling suka episod ini gookill 
3472,3472,3472,gokilll
3473,3473,3473,seru banget lagi
3474,3474,3474,menit 60 keatas 18 
3475,3475,3475,yuk vidi yuk buat vidioclip ulang 
3476,3476,3476,kocak
3477,3477,3477,capek gua nontonnya ketawa mulu wkkwkwkw
3478,3478,3478,masyaallah  om deddy terima kasih banyak ya sdh ngundang vior  habib masyaallah sedari nonton mpe selesai aku ga berhenti tertawa dengan semua kepolosan vior  tapi ada benernya
3479,3479,3479,suka episode ini
3480,3480,3480,bentar lagi kan ramadhan bagus nya vidi buat lagu religi dengan habib jafar
3481,3481,3481,episode terpecah 
3482,3482,3482,aq suka kalau vior sama habib n vidi
3483,3483,3483,jir topiknya loncat2 lg bahas api penyucian tiba2 bahas tulisan tangan terus lg bahas habib kenapa tau tentang agama kristen tiba2 bahas tulisan tangan lagi
3484,3484,3484,vior slalu kocak dan gokil
3485,3485,3485,skip
3486,3486,3486,3kata lucu ttnya vincent mantap
3487,3487,3487,hahahahaa masih di menit 16 udah ketawa sakit perut cocok nih habibvior dan onad
3488,3488,3488,klo ada vior ga pernah gue skip cepetin ucuuuu bgt
3489,3489,3489,kenapa vidi disebut dajjal sm habib jafar karna dia terlalu egois dia tidak tampak marah saat berbincang dengan vior
3490,3490,3490,keren sih udah mau 2jt aja
3491,3491,3491,habib  vior  siap2 kencing dicelana 
3492,3492,3492,pertanyaan2 vior tuh mostly mewakili pertanyaan2ku pas aku masih sd smp dulu sempat berpikir hal2 seperti itu dan ga dapat jawabannya terima kasih podhub
3493,3493,3493,345 tapi ente keturunan nabi boyyyy
3494,3494,3494,4009 wkwkkwkwwk mereka semia sampe diem bingung jwbnya
