,Unnamed: 0.1,Unnamed: 0,comment
1556,1556,1556,maksih ya bib jafar om ded ka vidy dek vior berkat kalian aku mulai bisa tersenyum stelah 2 hari ini aku mengetahui bahwa suamiku selingkuh dg tmn kerja yg juga baik banget sm aku segitu prcaya dan bodohnya aku smpai aku gk sadar mereka bermain dibelakang tp alhamdulillah allah masih sayang keluarga ku sehingga perselingkuhan ini cepat terungkap dan qodarullah tdk smpai terjadi zina secara dzohir pokonya terimakasih banyak buat kalian
1557,1557,1557,bekas sc ngilu banget gara gara ngakak terus terguncang jaitanku
1558,1558,1558,undang lagi vior yaaa
1559,1559,1559,vioooorrr kocak banget 
1560,1560,1560,5936 
1561,1561,1561,kata gw bikin video klip lagi sihh versi menjelang bulan puasa yg ada habib nya
1562,1562,1562,sembur make aer ratib bib biar kaga kopong bgt itu si vior hahhaaha
1563,1563,1563,tolong ini lucu banget hahahahahahahahhaha
1564,1564,1564,kita bukan nabi boy
1565,1565,1565,vior diciptakan untuk menguji kesabaran habib jafar
1566,1566,1566,11655 kasihan yah ada bapak ngejoks gk di tanggepin
1567,1567,1567,udah 2 x nonton tetep ngakak bgt pas si ini paket kumplit yg saling melengkapi setiap minggu  bintang tamunya habibvior juga setuju hiburan emak dikala liburan anak sekolah
1568,1568,1568,duuuuuh vior nitavior1 waktu d menit 4008 detik aku refleks langsung ketawa terbahak sendiri tak tau knpa liat bang vidi  habib  om ded diam sketika kyak bengong dgn terheran
1569,1569,1569,4052 adalah aku yg menyadari bahwa hidup makin kesini makin kaya tai 
1570,1570,1570,trimakasih podhub sudah undang kak habib dan vior butuh part 2 nya bareny vincent juga
1571,1571,1571,part 2 plisssss tambah vincent om dedkak vidi kak habib vior dan vincent plisssss
1572,1572,1572,walaupun berisik vior nyatapi tetap menghibur kok  karena ada habib jugajadi ada masukan ilmu agama nyabuat pobhub bang dedy vidi dan kru semuasukses selalu sehat semua dan selalu dalam lindungan allah swt  aamiin 
1573,1573,1573,suka banget eps iniiiii
1574,1574,1574,banyakin konten ada habis  vior donk pleaseqw emak suka bgt ma vior habib ini podhub 4 orang pecah deh suka bgt
1575,1575,1575,vidialdiano tumblernya dong
1576,1576,1576,ya allah aku nnton dari awal sampe ahir kebawa sampe sakit perut 
1577,1577,1577,om ded sehat selalu yaakk
1578,1578,1578,bikin lagu religi dong vidialdiano ntr ada habib jafar om dedi dll
1579,1579,1579,nangis banget sama kak vior 
1580,1580,1580,suka kalau vior dan habib jafar dipertemukan 
1581,1581,1581,tolong ini ngakak banget 
1582,1582,1582,lucu bnget klo habib gabung sma vior 
1583,1583,1583,loh radit manaa
1584,1584,1584,cape banget menit menit akhirr dari tanya bagus nya gaya apa
1585,1585,1585,ampun dah ampe ngakak klo pake ini lebih kaya ip man
1586,1586,1586,11407 masya allah
1587,1587,1587,kitab fathul izzarqurrotaul uyunnukhudul ijainkitab favorit anak pondok wkwkk
1588,1588,1588,podhub terseru so far 
1589,1589,1589,sumpah ni orang klo di satuin sumpah ngakak abisss
1590,1590,1590,5840 perkumpulan agus pas gathering nyariin temen manggil gus agus yang nengok seisi ruangan
1591,1591,1591,2143 om ded mode emak2 kompor meleduk 
1592,1592,1592,sumpah gua nonton podhub baru kali ini excited banget sampe ngakak ginjal ginjal mood banget sumpah
1593,1593,1593,nah yg ini paling seru  habis  vior  kak vidi  om ded yg udh jadi pelawak sekarang  laaahhh ini baru persatuan kesatuan pod hub  seruu abiss episode ini makasi podhub sudah menghibur
1594,1594,1594,sepanjang nonton aku kasian sama om dedy  ampun dah ka vior polose kelewatan  plis ka vior jgn brisik disembarang tempat
1595,1595,1595,gw yg bohong 
1596,1596,1596,paling suka nonton habib sm vior 
1597,1597,1597,vior
1598,1598,1598,om deddy emosi sama vior 
1599,1599,1599,ampun khabib
1600,1600,1600,aku nonton karna ada vior tpi nanti minggu depan tolong undang anwar bab sama frislly herlind dong bahas hororpengen liat kak vidi ngobrol sama marshatmn hantunya frislly dan reaksinya kak vidi sama anwar yg penakut kyk gmana pasti heboh karna ada anwarnya atau undang gilang dirga sama adiezty ngomongin soal adiezty yg pernah jadi asisten om dedi waktu masih main sulap atau undang gilang dirga sama rina nose bahas soal impersonate artis
1601,1601,1601,om ded kaya enek bgt tp lucu
1602,1602,1602,dya yg tidak akan menghentikan hujan tp dy tidak akan membuat kita basah dan kedinganan karena hujan 
1603,1603,1603,baru sekarang nonton podhub full dari awal smpai akhir
1604,1604,1604,pas vior baca tulisan di tangannyagw masih bablangsung ketawaa
1605,1605,1605,full ngakak
1606,1606,1606,sehat selalu kalian yaaa terima kasih sudah menghibur kami bikin kami bahagia  baru kali ini liat pod hub isinya berdaging seru 
1607,1607,1607,sebenarnya dari tadi pengen di bahas tulisan yg ada di tangan vior tpi di potong terus sama habib jadinya kemna2 dan yg di salahin vior trus
1608,1608,1608,
1609,1609,1609,sorry jujur gw gatau vior siapa gimmick atau apa tapi jujur gw ikutan kesel v
1610,1610,1610,waktu sehat dan sehit 
1611,1611,1611,kasih kiyab qurotul uyun aja bib si vior
1612,1612,1612,harus tranding nihhh
1613,1613,1613,di rapel sama somasi sehat  panjang umur dan bahagia selalu semuanya 
1614,1614,1614,bengek gw kata vior loh kan beda konsep ga sih langsung pecah deh
1615,1615,1615,siapa yg ikutan nangis waktu ka vidi nangis smngtt ya ka vidi banyak yg sayang sama ka vidi semoga segala penyakit ka vidi diangkat oleh allah swt aamiin aamiin ya rabbal alamin
1616,1616,1616,asli ngakak terus dr awal pe akhir
1617,1617,1617,cape gw anj sama vior
1618,1618,1618,parahh loee vidi nge cancel habib diganti anya pulaa pdahal bagusan habibb kalii 
1619,1619,1619,baru kali ini podcast aq tonton dari awal sampe akhir no skip
1620,1620,1620,habib jafar dan vidi emang kalo di satuin seruuuu banget
1621,1621,1621,terngakak 
1622,1622,1622,om ded vior habib vior tambah onad donk 
1623,1623,1623,dari awal sampai akhir ngakak habis sampai batuk batuk
1624,1624,1624,ngakak bggt
1625,1625,1625,vidi mood banget 
1626,1626,1626,aku yg nonton jd ikutan bdoh klo vior yg ngomong 
1627,1627,1627,astaghfirullah vior
1628,1628,1628,lucu bangetttttt gilaaa 
1629,1629,1629,sumpah lo vior ga lucu ceplas ceplos lo
1630,1630,1630,sejak ada vior aku suka nonton podcast orang indo kpopers kembali ke tontonan orang indo nihh bos
1631,1631,1631,sukaaaa bangettttt
1632,1632,1632,pokoke kl ada si bocah kosong alamat cape ngakak terusseruheboh  rusuh
1633,1633,1633,pesan gw buat vincent semoga kau sabar2 aja lah ma vior
1634,1634,1634,
1635,1635,1635,3623 anjir gue percaya lagi kalo beli rumah harus salaman di depan pendeta 
1636,1636,1636,undang habib dan vincent
1637,1637,1637,selama 1jam17 menit mulutku auto senyum terus 
1638,1638,1638,vior energinya gak habis2 penasaran hari2 dia gt jg gak ya 
1639,1639,1639,si vior bebener yeeeee wkwkwkkw
1640,1640,1640,ini podcast yg terseru sepanjang aku nonton podcast apapunkocak  abis dan menyenangkan
1641,1641,1641,capek ngakak dari awal sampe keselek 
1642,1642,1642,vior cb deh download filter omongannya kadang kadang bikin  polos bgt ihh
1643,1643,1643,lanjutt part 2
1644,1644,1644,sumpah viooooorrrrr pipi gue pegel ngakak muluuuuuu kocak lo 
1645,1645,1645,kocak 
1646,1646,1646,pecahhhhh
1647,1647,1647,viorrrr pleaseee belajar lagi gak luunanya hal2 tentang agama katholik di habib wkwkwkwk
1648,1648,1648,
1649,1649,1649,kak habib
1650,1650,1650,njir podcast bikin ngakak mulu asli polos ni org bikin pusing hostnya 
1651,1651,1651,tp vior setelah nikah agak normal gaez
1652,1652,1652,yaallah ngakak mulu dah ningali podcast ini
1653,1653,1653,nah sklian aja undng anya geraldin am habib jafar hahah bahas temanya video clip vidi 
1654,1654,1654,kocakkkk mrka 
1655,1655,1655,
1656,1656,1656,y alloh vior buat q ngangah trus ini pembahasan awal jd lupa 
1657,1657,1657,kita nikahnya sama tanggal 7 desember hihihi vior selalu kocak dah tambaj ada habib
1658,1658,1658,vioooooor luv u
1659,1659,1659,seru banget wlpun nontonya ikutan capek ya krna vior
1660,1660,1660,tidak bermutu
1661,1661,1661,ngakak sepanjang nontonny
1662,1662,1662, vior gendeng
1663,1663,1663,kocak 
1664,1664,1664,gaya kangguru menggendong anak
1665,1665,1665,4935  lucu liat om ded di toel bantal sma vior 
1666,1666,1666,ngakak habis
1667,1667,1667,tapi emang boleh ngomong dajjal ke orang walaupun konteks nya bercanda
1668,1668,1668,makin ga sabar menanti ramadhan  pingin nonton log in 
1669,1669,1669,sabar ya om  ded
1670,1670,1670,ngakak bett ketawa sampe nangis ya allah 
1671,1671,1671,baru satu hari dah 28 kompaknya kk habib sama kk vior
1672,1672,1672,wkwkkwkw seru bgt anjirtt kalo udh ada habib sama vior bestttt kombo bgtt 
1673,1673,1673,gw mesem mesem cengar cengir trus ngakak sendiri wkwkwkwk
1674,1674,1674,vior bikin jantung2 yg nonton up and down 
1675,1675,1675,om buat episode aja lah
1676,1676,1676,udah deh syuting lagi aja
1677,1677,1677,menit brp waktu vior bilang touch touch gess
1678,1678,1678,kenapaa ya ngomong nya teriak teriak
1679,1679,1679,kebayang gmna nnt saat vior nikah cengengesan terus depan pastor  para umat 
1680,1680,1680,sehat sehit
1681,1681,1681,ngakak yaampuunn
1682,1682,1682,mau tahun 2025 backgroundnya ganti dongg bosan liatnya merah terusshehe
1683,1683,1683,ampunn om ded salah nyuruh nanya wejangan stelah nikah nyawkwkwkwk malah jd loss sama vior
1684,1684,1684,wkwkwk pertanyaan vior polos diluar orang kebanyakan 
1685,1685,1685,paling menghibur namun tetap penuh makna kehidupan keren
1686,1686,1686,aq putar pe 3xtetep aj ngekek
1687,1687,1687,pas saya lagi minum habib bilang si dajjal langsung masuk hidung woi airnya
1688,1688,1688,ngakak wkwk
1689,1689,1689,lah ketemu lagi mereka
1690,1690,1690,penat ku hilang sejenak nonton acara inii
1691,1691,1691,meskipun gak suka vior tapi suka habib jadi aku lihat entah knp ya gak lucu vior cuma habib jadi ya nikmati aja ya itu rasaku
1692,1692,1692, ngakak
1693,1693,1693,kasian habib sampai mukanya capek ngomong sm vior sabar ya habib wkwkwk
1694,1694,1694,ga ada somasi
1695,1695,1695,
1696,1696,1696,ngakak bgt pas vidi nanyain strada saha haha pls
1697,1697,1697,pliss suka bangett kalo ada habib jafarr sama vior best combo sihh seruuu
1698,1698,1698,suka banget kalau ada 2 orang ini yaitu habib jafar dgn vior jadi kesannya seperti nonton drama kehidupan mini gitu si vior berlakon sebagai orang awam dgn segala pertanyaan yang terkadang terlihat recah tetapi bermanfaat untuk kehidupan kita seharihari dan si habib menjawab dgn bahasa yang mudah dicerna oleh segala kalangan tapi memojokkan agama rasa atau suku tertentu menurut ku kombinasi yang sempurna antara vior dgn habib jafar sehatsehat selalu love you
1699,1699,1699,ii ini parah ini
1700,1700,1700,belum tayang kah somaisinya 
1701,1701,1701,gak ada stand up nihh om tumben jam segini blm nongol
1702,1702,1702,astaghfirullah viorrr  tak tonton sampai akhir ngakakkk truss
1703,1703,1703,somasi belum upload om
1704,1704,1704,kocak
1705,1705,1705,nonton podcas berasa nonton super comedy
1706,1706,1706,kayak e kalo om ded undang mak e soimah atau ghost ranger indonesia keren sih
1707,1707,1707,knp ya org pada suka bgt sm bocah lolot ini
1708,1708,1708,ci pior cocok banget sama habib jafar 
1709,1709,1709,somasi belum tayang om  sudah lewwat jam 0900 wib
1710,1710,1710,ketriger banget sama sofa cover yang berantakan
1711,1711,1711,aku lanjutkan nonton ini lain waktu aku capek
1712,1712,1712,enak ditonton ini
1713,1713,1713, pecahmaksud gw otak habib jafar yg pecah gegara vior  harus super sabar emg bib kalo sama dia 
1714,1714,1714,kabib palsu
1715,1715,1715,combo ter the best 
1716,1716,1716,
1717,1717,1717,rame kalau ada vior 
1718,1718,1718,belum sehari udah 27 yg nonton
1719,1719,1719,klo ada vior kak habib pasti selalu rame seru 
1720,1720,1720,lah bawa habib orang menyombongkan keturunan padahal yaman tukang ngibul ngapain di undang
1721,1721,1721, bener2 vior mod booster bgt
1722,1722,1722,ngakak gua lihat ekspresi om ded  405011 
1723,1723,1723,kita bukan malaikat bib soalnya nabi juga prnah melakukan kesalahan contohnya nabi adam makanya diturunkn ke bumi
1724,1724,1724,kocakkkk
1725,1725,1725,next somasi
1726,1726,1726,seruu bangett podcast nyaaa
1727,1727,1727,sengaja nonton podhub yg lucu lucu biar booster tubuh soalnya senin mau operasi usu buntu ngakak ngakak
1728,1728,1728,tentang bagaimana cara jitu menghentikan konflik hamas israel
1729,1729,1729,ada 3 tantangan untuk para ulama seluruh indonesia yang terdapat dalam link dibawah ini 
1730,1730,1730,versi pod hub terlucu 1 radit  vior 2 habib jafar  vior
1731,1731,1731,viorkek bajaj bajuri yg jadi oneng
1732,1732,1732,masyaallah emang ni podhub mood booster banget sakit gw sembuh setelah nonton ini terimakasih kalian memang komposisi yg klop
1733,1733,1733,somasi mana
1734,1734,1734,halo admin bang dedi ada berita prospektif viral
1735,1735,1735,pertanyaan vior diakhir kocak
1736,1736,1736,coba dong niken salindry sama ka vidi kaya nya kalo di satuin enak
1737,1737,1737,episode inii fix kocak dari awal mpe akhir dan liat om ded tersiksa smpee duduk nyaa minggir bgt
1738,1738,1738,eh om ded buktikan kalau luh cinta indonesia ayo bahas isu nasab perhabiban cookkkkkkkkkkk asuuu jangan sia siakan pangkatmu cokkkk
1739,1739,1739,ngakak bangetttt
1740,1740,1740,tlg sering2 undang vior menghibur banget
1741,1741,1741,hahahha lucu
1742,1742,1742,vidikayaknya perlu extended videoklip nya deh yg versi habib
1743,1743,1743,kocakk bngt piorrr ampun wkwkw
1744,1744,1744,
1745,1745,1745,yahh bintang tamunya itu2 mulu mana dua2nya lagi pdhl msh byk bgt bintang tamu
1746,1746,1746,penasaran woi fakkkkta nya vior di log in nanti kocak dah
1747,1747,1747,penonton pun di uji jg kesabarannya 
1748,1748,1748,asli kocak bgt yok tranding bisa yok biar lanjut part 2
1749,1749,1749,ya alloh aku full ngakakkk makasi om ded kak vidi kak habib ka viorr
1750,1750,1750,sumpah ci vior komedian berkedok ba
1751,1751,1751,obrolannn gajelasssss bersama viorenita sutanto
1752,1752,1752,vior lucu banget sihapa adanya
1753,1753,1753,ya allah capek bangeeet 
1754,1754,1754,5715 muka vidi lucu bgt
1755,1755,1755,langsung kecilin volume pas vior nanyain gaya bokep  bapakku disebelahku nonton vior ya ketawa ya istighfar 
1756,1756,1756,sumpah ngakak terus dengernya
1757,1757,1757,masyaallah ngakak parah gara2 vior 
1758,1758,1758,seharusnya sih yang mengislamkan om ded lebih baik habib ini daripada yang ono noh
1759,1759,1759,wkwk
1760,1760,1760,asli ini kosong bangeet bocaah yaakkbagus habib sabaar
1761,1761,1761,undang fadil dan pak muh dong
1762,1762,1762,asli ngakak mlu sama ceplas ceplosnya vior astaga
1763,1763,1763,piorr
1764,1764,1764,ngakak woi
1765,1765,1765,berisik  mendesah 
1766,1766,1766,5911 sumpahh ngakak
1767,1767,1767,vior  gaya apa yang memuaskan suami  astaga vior 
1768,1768,1768,kek bapak sama anak 
1769,1769,1769,bisa ga isi podcast semua tentang vior kocakkkk
1770,1770,1770,gaya apa bib itu bagus loh bib
1771,1771,1771,yuk bisa yuk rilis lagi religi kwkwkwk munculkan anya dan habib kwkwkwk
1772,1772,1772,lucu bgttt kali ini vior kocak
1773,1773,1773,0802 
1774,1774,1774,undang lgi dongg sama vincenttvior sudah eling sekarang abis nikah
1775,1775,1775,sehit gak tuh vior gemesss aku sabar ya om ded mas vidi habib
1776,1776,1776,ooiii pantek lah  otong otong
1777,1777,1777,jangan gitu om vior itu suka negatif thingking
1778,1778,1778,ya allah plaster punggung tangannya kak vidi aldiano sampai belum di lepas semangat kak vidi semoga di beri kesembuhan di beri kesehatan tanpa rasa sakit dan setiap ikhtiar di jadikan sebagai pahala aamiin aamiin aamiin ya allah
1779,1779,1779, kocak emng pior
1780,1780,1780,kering gigi gua 
1781,1781,1781,gemes banget ini semua nya apalagi vior harus ada part 2 sama vincent sih 
1782,1782,1782,lucu banget sih vior ini auranya positif banget
1783,1783,1783,nyusahinberisikitu kan vior banget vincent wkwkwkwk ngakak
1784,1784,1784,vior ma vincent ke podhub dunk pasti kocak tu
1785,1785,1785,mangga besar tempat pijet
1786,1786,1786,ya allah ngakak parah sih kalo udah nton podcast yg ada viornyaa 
1787,1787,1787,ngakak
1788,1788,1788,27 jt view stlh 23 jam upload 
1789,1789,1789,strada lucu loh
1790,1790,1790,
1791,1791,1791,yuk vid bisa tuk vid lagi religi buat ramadhan bisa pake vior habib sebagai model videoclip
1792,1792,1792,ada ada aja 
1793,1793,1793,bocah kosomg kesayangan om ded
1794,1794,1794,vior      out of the boxbaru mulai pecahbib bib tot  
1795,1795,1795,aq rasa vior adhd 
1796,1796,1796,om deddy kenapa nyuruh bang ferry berhenti bersuara klenik dukun
1797,1797,1797,kali ini habib kena sih wkwkwk
1798,1798,1798,mksdnya 3 kata nerakajadi kalo pacaran sama orang katholik pasti masuk neraka
1799,1799,1799,udah paling bener nonton podhub
1800,1800,1800,sehat dan sehit
1801,1801,1801,ini ni episode bikin gua ngakak banget cok
1802,1802,1802,pas ngomong titit vincet mantap alemong pas makan langsung kesedak aku
1803,1803,1803,corbuzier emang ngk ada bintang tamu lain lagi ya hadehh
1804,1804,1804,tahun depan login harus ada vior sama vincent nih pasti seru banget
1805,1805,1805,ngakak banget dari awal 
1806,1806,1806,ni ank kyk pura2 polos njir kalau maslah 18 kencang
1807,1807,1807,woi vidi gua suka bgt ama cara lo ngomong 
1808,1808,1808,deddycorbuzier ngapain sih ngundang orang ngk jelas
1809,1809,1809,palak gw sakit kalo bintang tamunya pior wkwkwkwk kadang lucu banget kadang krik krik tapi sukaa 
1810,1810,1810,baru kali ini nonton podhub ngakak
1811,1811,1811,vincent  iya habibvior  kok nggak pakek kak 
1812,1812,1812,ngakak dari awal smpe akhir 
1813,1813,1813,udah 3 kali vior di undang 
1814,1814,1814,kasihan om deddy mau jokes apart jadi alphard tapi ke skip 
1815,1815,1815,
1816,1816,1816,gak bisa kebayang si vincent ngadepin vior seumur hidupnyasemoga samawa ya vior vincent
1817,1817,1817,ntn dari awal sampe akhir ngakak terus
1818,1818,1818,gaya gak tu agus sedih ini pasti
1819,1819,1819,podhub lo kureng sih bikinlah episode jgn sabtu ajaminggu senen selasa rabu kamis jumat
1820,1820,1820,next datangin kang dicky chandra dong 
1821,1821,1821,sotoy nya itu lho se akan2 vior paling ngerti pdahal dia sendiri gk tau  kmna arahnya
1822,1822,1822,ajg ngakak bgtt guaaaa
1823,1823,1823,kusimpan kua awet awetin buat stock temanin nyuci beberes rumah
1824,1824,1824,11111
1825,1825,1825,pokoknya suka klo ada vior dan habib
1826,1826,1826,capek ketawa 
1827,1827,1827,
1828,1828,1828,membuah orang ketawa mulu vior
1829,1829,1829,waxing bulu jem 
1830,1830,1830,hahaha ngakak bgt pecah bgt si asli
1831,1831,1831,capek bgt sama viordia yg ngomong aku yg maluu
1832,1832,1832,gk usah hubab habil lah kelakuan kaya iblis
1833,1833,1833,anying pecahhhh 
1834,1834,1834,hadhhuuuhhngakak bener  om dedy suka bnget bikin gara2 bikin ngakak habib baik banget vidi care bangetlove it
1835,1835,1835,440  akhirnya keluar dikit bib ikut ngakak gw 
1836,1836,1836,memang betul gak pernah telat lihat podhub dr awal sampai skr karena ada vidi  seperti lihat karakter lawak baru 
1837,1837,1837,seruuuu bangett 
1838,1838,1838, 1000 aura habib jafar  ketemu vior
1839,1839,1839,vior ngomong ceplas coplospasti mlm pertamanya seru ini
1840,1840,1840,vior buka kitab fathkul idzar aja 
1841,1841,1841,nangis bangett ya allah vidi sama ka habib vior sumpah ngakak aku
1842,1842,1842,kalau gak cantik mungkin gak ada yg menarik untuk ditonton
1843,1843,1843,membawa kebahagiaan banget
1844,1844,1844,dear team podhubsering habib jafar ketemu vior
1845,1845,1845,omded makin lama makin lucu makin gemoy deh
1846,1846,1846,sukses terus pud hab aku suka sekali pas hari ini ada habib jafar dan cici vior seruuuu
1847,1847,1847,pecah  wkwkwkwkwkwk hari minggu ku ceria 
1848,1848,1848,kocak bangat vior semoga sakinah mawaddah warohmah nitavior dan vincen
1849,1849,1849,menguras emosi 
1850,1850,1850,sumpahhh capek banget nnton podhub x ini 
1851,1851,1851,bener banget tiap hari sabtu nungguinya cuma mau liat vidi
1852,1852,1852,vior vibesnya menyenangkan bangettt
1853,1853,1853,vioooooor hahahaeeeeee
1854,1854,1854,bingung dah ini
1855,1855,1855,kak habib masih jadi panggikan ikonik 
1856,1856,1856,4nj1ng 0t4k gu4 p1nc4ng ly4t v1or episode ini 1506
1857,1857,1857,wkwkwk baru kali ini liat om ded sesetres ini 
1858,1858,1858,4nj1ng 0t4k gu4 p1nc4ng ly4t v1or episode ini
1859,1859,1859,mode duduk terintimidasi om dedy 
1860,1860,1860,saya suka vior dg sebutan kak habibnya 
1861,1861,1861,asli makasih podhub ak ngakak terus nonton episode ini
1862,1862,1862, ampun vior
1863,1863,1863,159habibgw login sdh 2 thnvioralhamdulillahgw yaqin pikiran vior beda dikira habib baru masuk islam
1864,1864,1864,gusti kocak cape banget gue
1865,1865,1865,sok ngegym wkwk
1866,1866,1866,pembukaan yg mmbagongkan 
1867,1867,1867,nonton ini gw banyak ngakak undang lagi dong om habib jafar dan vior part 2
1868,1868,1868,guys saya lagi ganggur sudah usaha cari belum dapat kalau ada yang punya kerjaan saya mau apa aja asal halal saya rumah dibekasi saya ahli ngedit video photo photoshop
1869,1869,1869,kocak banget anjir ampe keluar air mata ngakak truss
1870,1870,1870,good
1871,1871,1871,pertanyaan vior bikin ngakak
1872,1872,1872,vioorrrr
1873,1873,1873,kali ini ketawa melulu seru banget menghibur
1874,1874,1874,hahahaha astaghfirullah benarbenar konten ynag menghibur
1875,1875,1875,good
1876,1876,1876,4120 materai halal 
1877,1877,1877,ini yang ditunggutunggu hahahahaaaa
1878,1878,1878,mulaibdaribawal sampek akhir ngaakak yerusviorr lu lugu polos apa gimana yaastaqfirullah sampek sakit perut
1879,1879,1879,lucu banget om ded di menit 4937 
1880,1880,1880,awalnya aku ga respect  terus aku mencoba mulai repect  lah pas nonton video ini  full aku kecewabang vid doa yang paling baik itu adalah doa doanya para nabi orang orang alim dan doanya orangtua setahuku ga ada orang alim bercanda bawak2 kata dajjalterus dipanggil om ded bro ga terimamaaf ya jafar bukannya aku sok suci tuhan bilang semua orang dimata allah itu sama yang aku lihat juga amalan ente ga ada apa2nya sama om dedjangan dibawa2 kali keturunan nabi itu  sama cara tuhan nanti menghisab kita  aku cuma mau kasih pesan  jangan jauh kali ke tengah tenggelam nanti
1881,1881,1881,10218 brutal sekali pertanyaan si vior  wkwkwkkwkwkw
1882,1882,1882,seru banget jadi ketawa ketawa sendiri
1883,1883,1883,bisa2 nya gw nnton sampe 3 kali tnpa skip skip ttep ngakak trs 
1884,1884,1884,jadi suka nnton merekegak berenti ketawa aku
1885,1885,1885,wah kocak ni vifior
1886,1886,1886,5856 nah ini ni pertanyaan daging dari bang vior 
1887,1887,1887,sepanjang nonton podhub gua paling lucu sama om ded di episode ini sumpah wkwkwkw
1888,1888,1888,lucu bngttt
1889,1889,1889,
1890,1890,1890,vidi touchy banget sih risih liatnya 
1891,1891,1891,harus ada segmen khusus utk vior di login tahun depan sih 
1892,1892,1892,berisik bgt
1893,1893,1893,kocakk
1894,1894,1894,bikin vidio clip ulang yuk
1895,1895,1895,
1896,1896,1896,
1897,1897,1897,part 2 nya plisss ada vincent nya ya d part 2
1898,1898,1898,terkocak sii ini yv tdnya ngantukk jd melek lg
1899,1899,1899,aduh terimakasih podhup jdi ketawa terus
1900,1900,1900,sah sah sah saudara2 gak
1901,1901,1901,
1902,1902,1902,
1903,1903,1903,sh vior knapa sh yha 
1904,1904,1904,5914 
1905,1905,1905,vidi lebay
1906,1906,1906,energinya ga habis2 vior
1907,1907,1907,ngakak nangis saat bahas mama vidi chat habib kemudian lanjut ngakak lagi ya allah sehebat itu podhub yang katanya gak ada konsep mengotak atik perasaan pemirsanya
1908,1908,1908,vior cape 
1909,1909,1909,vior lucuuuupantesan vincent jatuh cinta ke vior
1910,1910,1910,episod paling lucu ni 
1911,1911,1911,viorrr lucuuu bgt
1912,1912,1912,1042 om jangan om
1913,1913,1913,1157 udah nyontek pun masi aja salahbwahahahaha
1914,1914,1914,baru kali ini liat om ded lebih pendiem
1915,1915,1915,mahal itu tasbih cincin nya
1916,1916,1916,suka bngitz ada habib di podhub 
1917,1917,1917,ketawa sepnjng nntn nya
1918,1918,1918,344 habib jafar the inpostor
1919,1919,1919,menyalahh bang piorr
1920,1920,1920,gg
1921,1921,1921,saya juga nangis lhoo anjirr kok gue nangis parahvidi syafakallah khairan semoga allah azza wa jalla mengangkat penyakit kamu ya vidi aldiano
1922,1922,1922,menit 1301 kyknya dipotong ya soalnya kalo ga salah sebelumnya jari vior keliatan kesitu sedangkan skarang dipotong jadi keliatan lengan doang tapi bagus biar menjaga penonton
1923,1923,1923,undang ghost ranger indonesia om
1924,1924,1924, duh cape  vior
1925,1925,1925,bawaan nya happy terus
1926,1926,1926,habib jafar jadi kocak ya tuhannn 
1927,1927,1927,luar biasa syiar si husein jafar di dukung deddy mualaf
1928,1928,1928,17jam 2juta lebih viewers masak yaa si  ga trending
1929,1929,1929,seruu banget
1930,1930,1930,cerita kehidupan nuaiman dan nabi itu bagus
1931,1931,1931,pertama kali komen di youtube tp konten ini lucu polll dari awal sampe akhirr gokillll
1932,1932,1932,capek banget ketawa gueeee wkwkwkw
1933,1933,1933,gw demen liat ekspresi omded jd korban viorkapan lagi liat omded terintimidasi
1934,1934,1934,bebaskan 7 terpidana kasus vina cirebon mereka tidak bersalah
1935,1935,1935,vior rosting habib jafar abis abisan kocak vior 
1936,1936,1936,klo udh ada habib tetap di pantengin jd inget moment ramadhan klo sdh ada habib jafar
1937,1937,1937,
1938,1938,1938,5936 
1939,1939,1939,sumpah ngeliat ekspresi om ded bikin sakit perut q
1940,1940,1940,capek banget kalo lawan bicara vior orang dewasa 
1941,1941,1941,suka liat vior karna mirip oniel 
1942,1942,1942,habib itu munafik
1943,1943,1943,gw nonis tp seneng bgt denger habib jafar dakwah adem dan relate bgt buat gw
